Index,Concept,Question,Answer,Photo,photo_path
255.0,Mortuary_Temple_of_Thutmosis_III,Is it on the Nile's west bank?,"Yes, west bank.",,/downloaded_images/img_3443.jpg
255.0,Mortuary_Temple_of_Thutmosis_III,What is this temple's purpose?,Memorial temple,,/downloaded_images/img_3444.jpg
255.0,Mortuary_Temple_of_Thutmosis_III,Does it have courtyards?,Multiple courtyards,,/downloaded_images/img_3445.jpg
255.0,Mortuary_Temple_of_Thutmosis_III,Does it have a hypostyle hall?,"Yes, Hypostyle Hall.",,/downloaded_images/img_3446.jpg
255.0,Mortuary_Temple_of_Thutmosis_III,Are there shrines here?,"Yes, sanctuaries.",,/downloaded_images/img_3447.jpg
255.0,Mortuary_Temple_of_Thutmosis_III,Who is Amun-Re?,A deity.,,/downloaded_images/img_3438.jpg
255.0,Mortuary_Temple_of_Thutmosis_III,Are there king's chapels?,"Yes, King's chapels",,/downloaded_images/img_3439.jpg
255.0,Mortuary_Temple_of_Thutmosis_III,Does it show Thutmose's power?,"Yes, illustrates.",,/downloaded_images/img_3440.jpg
255.0,Mortuary_Temple_of_Thutmosis_III,What era is this from?,New Kingdom,,/downloaded_images/img_3441.jpg
255.0,Mortuary_Temple_of_Thutmosis_III,Is it New Kingdom design?,"Yes, New Kingdom",,/downloaded_images/img_3442.jpg
255.0,Mortuary_Temple_of_Thutmosis_III,Does it show religious beliefs?,"Yes, it does.",,/downloaded_images/img_3443.jpg
255.0,Mortuary_Temple_of_Thutmosis_III,Are there reliefs and inscriptions?,"Yes, beautiful reliefs.",,/downloaded_images/img_3444.jpg
255.0,Mortuary_Temple_of_Thutmosis_III,Whose achievements are shown?,Thutmose III's,,/downloaded_images/img_3445.jpg
255.0,Mortuary_Temple_of_Thutmosis_III,Does it have a pylon?,Entrance Pylon,,/downloaded_images/img_3446.jpg
255.0,Mortuary_Temple_of_Thutmosis_III,Is Hathor a deity?,"Yes, deity.",,/downloaded_images/img_3447.jpg
255.0,Mortuary_Temple_of_Thutmosis_III,Is this in Luxor?,"Yes, Luxor.",,/downloaded_images/img_3438.jpg
256.0,Qurnet_Murai,Where is this tomb located?,West Bank Luxor,,/downloaded_images/img_3448.JPG
256.0,Qurnet_Murai,What kind of site is this?,Tomb complex,,/downloaded_images/img_3449.jpg
256.0,Qurnet_Murai,Which period are the tombs from?,New Kingdom,,/downloaded_images/img_3450.JPG
256.0,Qurnet_Murai,Which city is it close to?,West Bank Luxor,,/downloaded_images/img_3451.JPG
256.0,Qurnet_Murai,Who was Amenemopet?,High Priest of Amun,,/downloaded_images/img_3452.jpg
256.0,Qurnet_Murai,What is TT36 known for?,Inherkhau's tomb,,/downloaded_images/img_3453.jpg
256.0,Qurnet_Murai,Is Horemheb a pharaoh?,"No, official.",,/downloaded_images/img_3454.JPG
256.0,Qurnet_Murai,What do the walls depict?,"Daily life, afterlife.",,/downloaded_images/img_3455.jpg
256.0,Qurnet_Murai,What are researchers doing?,Excavation and conservation.,,/downloaded_images/img_3456.JPG
256.0,Qurnet_Murai,What beliefs are depicted?,Religious rituals,,/downloaded_images/img_3457.JPG
256.0,Qurnet_Murai,What is being conserved?,"Tombs, site",,/downloaded_images/img_3458.JPG
256.0,Qurnet_Murai,What kingdom is it from?,New Kingdom.,,/downloaded_images/img_3459.jpg
256.0,Qurnet_Murai,What is TT29's title?,High Priest,,/downloaded_images/img_3460.JPG
256.0,Qurnet_Murai,What is Theban Necropolis?,West Bank Luxor,,/downloaded_images/img_3461.JPG
256.0,Qurnet_Murai,What project maps it?,Theban Mapping,,/downloaded_images/img_3462.jpg
257.0,Paromeos_Monastery,What is the image about?,Moni Paromorfi,,/downloaded_images/img_3485.JPG
257.0,Paromeos_Monastery,What region is this monastery in?,Central Greece,,/downloaded_images/img_3486.jpg
257.0,Paromeos_Monastery,What is the monastery's Greek name?,Moni Paromorfi,,/downloaded_images/img_3487.JPG
257.0,Paromeos_Monastery,What event does it commemorate?,Transfiguration of Jesus,,/downloaded_images/img_3488.jpg
257.0,Paromeos_Monastery,Where is Trikala?,Central Greece,,/downloaded_images/img_3489.JPG
257.0,Paromeos_Monastery,What kind of art is inside?,"Frescoes, hagiography",,/downloaded_images/img_3490.jpg
257.0,Paromeos_Monastery,What's the likely name of this?,Moni Paromorfi,,/downloaded_images/img_3491.JPG
257.0,Paromeos_Monastery,Is it a common name?,"No, likely not",,/downloaded_images/img_3492.JPG
257.0,Paromeos_Monastery,What is its significance?,Transfiguration commemoration,,/downloaded_images/img_3493.png
257.0,Paromeos_Monastery,What faith is practiced here?,Orthodox Christian,,/downloaded_images/img_3494.jpg
258.0,Pyramid_of_Teti,Where is this pyramid?,"Saqqara, Egypt",,/downloaded_images/img_3499.JPG
258.0,Pyramid_of_Teti,Who built this pyramid?,Teti,,/downloaded_images/img_3500.jpg
258.0,Pyramid_of_Teti,Which dynasty built this?,Sixth Dynasty,,/downloaded_images/img_3501.jpg
258.0,Pyramid_of_Teti,Are the walls inscribed?,"Yes, Pyramid Texts.",,/downloaded_images/img_3502.JPG
258.0,Pyramid_of_Teti,What kind of texts?,Pyramid Texts,,/downloaded_images/img_3503.jpg
258.0,Pyramid_of_Teti,Is this pyramid ruined?,Heavily Ruined.,,/downloaded_images/img_3504.jpg
258.0,Pyramid_of_Teti,What material is it?,Local stone,,/downloaded_images/img_3505.jpg
258.0,Pyramid_of_Teti,Is it in Saqqara?,"Yes, Saqqara",,/downloaded_images/img_3506.jpg
258.0,Pyramid_of_Teti,Is it still studied?,"Yes, studied.",,/downloaded_images/img_3507.jpg
258.0,Pyramid_of_Teti,Is it a true pyramid?,"Yes, true.",,/downloaded_images/img_3508.JPG
258.0,Pyramid_of_Teti,Are there mortuary texts?,"Yes, Pyramid Texts",,/downloaded_images/img_3509.jpg
258.0,Pyramid_of_Teti,Is there a mortuary temple?,"Yes, mortuary temple",,/downloaded_images/img_3510.jpg
258.0,Pyramid_of_Teti,What's on the walls?,Pyramid Texts,,/downloaded_images/img_3511.jpg
258.0,Pyramid_of_Teti,Is casing still present?,Largely stripped,,/downloaded_images/img_3512.jpg
258.0,Pyramid_of_Teti,Is core exposed?,"Yes, heavily.",,/downloaded_images/img_3513.JPG
259.0,Pyramid_of_Ameni_Qemau,What dynasty is this pyramid from?,13th Dynasty,,/downloaded_images/img_3539.jpg
259.0,Pyramid_of_Ameni_Qemau,Where is this pyramid located?,Southern Dahshur,,/downloaded_images/img_3539.jpg
259.0,Pyramid_of_Ameni_Qemau,Who discovered this pyramid?,Charles Muss,,/downloaded_images/img_3539.jpg
259.0,Pyramid_of_Ameni_Qemau,What material is the core made of?,Mud brick,,/downloaded_images/img_3539.jpg
259.0,Pyramid_of_Ameni_Qemau,What was found in the chamber?,Sarcophagus of quartzite,,/downloaded_images/img_3539.jpg
259.0,Pyramid_of_Ameni_Qemau,What period does it belong to?,13th Dynasty,,/downloaded_images/img_3539.jpg
259.0,Pyramid_of_Ameni_Qemau,Was the king's reign long?,Short reign.,,/downloaded_images/img_3539.jpg
259.0,Pyramid_of_Ameni_Qemau,What was the pyramidion's quality?,Mediocre workmanship.,,/downloaded_images/img_3539.jpg
259.0,Pyramid_of_Ameni_Qemau,Is this pyramid well-preserved?,Heavily damaged.,,/downloaded_images/img_3539.jpg
259.0,Pyramid_of_Ameni_Qemau,Does it have a mortuary temple?,"Yes, complex included.",,/downloaded_images/img_3539.jpg
259.0,Pyramid_of_Ameni_Qemau,What does it reflect about the dynasty?,Decline in Resources,,/downloaded_images/img_3539.jpg
259.0,Pyramid_of_Ameni_Qemau,Who was the owner?,Ameni Qemau,,/downloaded_images/img_3539.jpg
259.0,Pyramid_of_Ameni_Qemau,What surrounds the pyramid?,"Mortuary temple, walls",,/downloaded_images/img_3539.jpg
259.0,Pyramid_of_Ameni_Qemau,What was the sarcophagus made of?,Quartzite.,,/downloaded_images/img_3539.jpg
259.0,Pyramid_of_Ameni_Qemau,When was it discovered?,1957,,/downloaded_images/img_3539.jpg
259.0,Pyramid_of_Ameni_Qemau,Is it a large pyramid?,"No, Smaller scale.",,/downloaded_images/img_3539.jpg
259.0,Pyramid_of_Ameni_Qemau,Is it in good condition?,Heavily damaged/Ruins,,/downloaded_images/img_3539.jpg
259.0,Pyramid_of_Ameni_Qemau,What part of Dahshur is it in?,Southern necropolis,,/downloaded_images/img_3539.jpg
259.0,Pyramid_of_Ameni_Qemau,What was the complex part of?,Larger complex,,/downloaded_images/img_3539.jpg
259.0,Pyramid_of_Ameni_Qemau,Is it from the Old Kingdom?,"No, 13th Dynasty",,/downloaded_images/img_3539.jpg
260.0,Mosque_of_Ibn_Tulun,What city is this mosque in?,"Cairo, Egypt",,/downloaded_images/img_3540.jpg
260.0,Mosque_of_Ibn_Tulun,What is the minaret's shape?,Spiral staircase,,/downloaded_images/img_3541.jpg
260.0,Mosque_of_Ibn_Tulun,What material is primarily used?,Red brick,,/downloaded_images/img_3542.jpg
260.0,Mosque_of_Ibn_Tulun,What dynasty built this?,Tulunid dynasty,,/downloaded_images/img_3543.jpg
260.0,Mosque_of_Ibn_Tulun,What year construction began?,876 AD,,/downloaded_images/img_3544.jpg
260.0,Mosque_of_Ibn_Tulun,What is in the center?,Open courtyard,,/downloaded_images/img_3545.jpg
260.0,Mosque_of_Ibn_Tulun,What is it known for?,Spiral minaret.,,/downloaded_images/img_3546.jpg
260.0,Mosque_of_Ibn_Tulun,What's the roof supported by?,Arches and piers,,/downloaded_images/img_3547.jpg
260.0,Mosque_of_Ibn_Tulun,What's decorating the mosque?,Stucco ornamentation,,/downloaded_images/img_3548.jpg
260.0,Mosque_of_Ibn_Tulun,What's the architectural style?,Abbasid architecture,,/downloaded_images/img_3549.jpg
261.0,Red_Monastery,What color is the monastery?,Red.,,/downloaded_images/img_3580.jpg
261.0,Red_Monastery,Is it a real place?,Unclear/Possibly not.,,/downloaded_images/img_3581.jpg
261.0,Red_Monastery,Is it widely known?,Not widely known.,,/downloaded_images/img_3582.jpg
261.0,Red_Monastery,Is the term definite?,"No, indefinite.",,/downloaded_images/img_3583.jpg
261.0,Red_Monastery,What context is needed?,Specific context,,/downloaded_images/img_3584.jpg
261.0,Red_Monastery,Could it be misspelled?,"Possibly, Yes",,/downloaded_images/img_3585.jpg
261.0,Red_Monastery,Does it exist in fiction?,"Possibly, yes.",,/downloaded_images/img_3586.jpg
261.0,Red_Monastery,Are there red associations?,"Yes, possible.",,/downloaded_images/img_3587.jpg
261.0,Red_Monastery,Is it formally named?,Possibly regional.,,/downloaded_images/img_3588.jpg
261.0,Red_Monastery,Is it a universal term?,No single meaning.,,/downloaded_images/img_3589.jpg
261.0,Red_Monastery,What does it lack?,Universal meaning.,,/downloaded_images/img_3590.jpg
261.0,Red_Monastery,Is it fragmented?,"Yes, fragmented.",,/downloaded_images/img_3591.jpg
261.0,Red_Monastery,Could it be misremembered?,"Possibly, yes.",,/downloaded_images/img_3592.jpg
261.0,Red_Monastery,What kind of work?,Fiction/Games,,/downloaded_images/img_3593.jpg
261.0,Red_Monastery,Is it in a game?,"Potentially, yes.",,/downloaded_images/img_3594.jpg
261.0,Red_Monastery,What is the name short?,Red Monastery,,/downloaded_images/img_3595.jpg
261.0,Red_Monastery,Is it ambiguous?,"Yes, very.",,/downloaded_images/img_3596.jpg
261.0,Red_Monastery,Is it a local name?,"Possibly, yes.",,/downloaded_images/img_3597.jpg
261.0,Red_Monastery,Is more information needed?,"Yes, context needed.",,/downloaded_images/img_3598.jpg
261.0,Red_Monastery,What associations are possible?,Color and religion.,,/downloaded_images/img_3599.jpg
262.0,Aqsunqur_Mosque,Mosque's nickname?,Blue Mosque,,/downloaded_images/img_3663.jpg
262.0,Aqsunqur_Mosque,Tiles' color?,"Blue, green, white.",,/downloaded_images/img_3663.jpg
262.0,Aqsunqur_Mosque,Located where?,"Cairo, Egypt",,/downloaded_images/img_3663.jpg
262.0,Aqsunqur_Mosque,Architectural style?,Mamluk architecture,,/downloaded_images/img_3663.jpg
262.0,Aqsunqur_Mosque,Who renovated it?,Ibrahim Agha,,/downloaded_images/img_3663.jpg
262.0,Aqsunqur_Mosque,Original founder?,Amir Aqsunqur,,/downloaded_images/img_3663.jpg
262.0,Aqsunqur_Mosque,Year originally built?,1347,,/downloaded_images/img_3663.jpg
262.0,Aqsunqur_Mosque,Tile origin?,Turkish (Iznik),,/downloaded_images/img_3663.jpg
262.0,Aqsunqur_Mosque,Still active?,"Yes, tourist site.",,/downloaded_images/img_3663.jpg
262.0,Aqsunqur_Mosque,Decoration material?,Iznik tiles,,/downloaded_images/img_3663.jpg
262.0,Aqsunqur_Mosque,What's inside?,Iznik tiles,,/downloaded_images/img_3663.jpg
262.0,Aqsunqur_Mosque,Tile colors?,"Blue, green, white",,/downloaded_images/img_3663.jpg
262.0,Aqsunqur_Mosque,Contains minarets?,"Yes, contains",,/downloaded_images/img_3663.jpg
262.0,Aqsunqur_Mosque,Agha's title?,Ottoman amir,,/downloaded_images/img_3663.jpg
262.0,Aqsunqur_Mosque,Whose Mamluk?,Aqsunqur al-Nasiri,,/downloaded_images/img_3663.jpg
263.0,Pyramid_of_Nyuserre_Ini,What Pharaoh built this?,Nyuserre Ini,,/downloaded_images/img_3664.jpg
263.0,Pyramid_of_Nyuserre_Ini,Which Dynasty is this?,Fifth Dynasty,,/downloaded_images/img_3665.jpg
263.0,Pyramid_of_Nyuserre_Ini,Where is this pyramid?,Abu Gorab,,/downloaded_images/img_3666.JPG
263.0,Pyramid_of_Nyuserre_Ini,What is well-preserved?,Mortuary temple.,,/downloaded_images/img_3667.JPG
263.0,Pyramid_of_Nyuserre_Ini,What connects the temples?,Causeway.,,/downloaded_images/img_3668.jpg
263.0,Pyramid_of_Nyuserre_Ini,What are the columns made of?,Granite palm,,/downloaded_images/img_3669.JPG
263.0,Pyramid_of_Nyuserre_Ini,What is in the temple?,Granite palm columns.,,/downloaded_images/img_3670.JPG
263.0,Pyramid_of_Nyuserre_Ini,Was the pyramid tall?,Relatively small,,/downloaded_images/img_3664.jpg
263.0,Pyramid_of_Nyuserre_Ini,Where is Abu Gorab?,Near Abusir.,,/downloaded_images/img_3665.jpg
263.0,Pyramid_of_Nyuserre_Ini,What is largely intact?,"Causeway, Mortuary Temple",,/downloaded_images/img_3666.JPG
263.0,Pyramid_of_Nyuserre_Ini,What is the pyramid encased in?,Fine limestone.,,/downloaded_images/img_3667.JPG
263.0,Pyramid_of_Nyuserre_Ini,Is it best-preserved?,"Yes, best-preserved.",,/downloaded_images/img_3668.jpg
263.0,Pyramid_of_Nyuserre_Ini,What cult is highlighted?,Solar cult,,/downloaded_images/img_3669.JPG
263.0,Pyramid_of_Nyuserre_Ini,What is in Abu Gorab?,Pyramid complex.,,/downloaded_images/img_3670.JPG
263.0,Pyramid_of_Nyuserre_Ini,Is it an Old Kingdom pyramid?,"Yes, Fifth Dynasty",,/downloaded_images/img_3664.jpg
264.0,Coloured_Canyon,What peninsula is this in?,Sinai Peninsula,,/downloaded_images/img_3671.png
264.0,Coloured_Canyon,What city is nearby?,"Nuweiba, Egypt",,/downloaded_images/img_3672.jpg
264.0,Coloured_Canyon,What rock is this made of?,Sandstone.,,/downloaded_images/img_3673.jpg
264.0,Coloured_Canyon,What process formed this?,"Tectonic, erosion",,/downloaded_images/img_3674.jpg
264.0,Coloured_Canyon,What colors are visible?,"Red, orange.",,/downloaded_images/img_3675.jpg
264.0,Coloured_Canyon,What is the canyon like?,"Narrow, colourful canyon.",,/downloaded_images/img_3676.jpg
264.0,Coloured_Canyon,What activity occurs here?,"Hiking, sightseeing.",,/downloaded_images/img_3671.png
264.0,Coloured_Canyon,Is this wide or narrow?,Narrow canyon,,/downloaded_images/img_3672.jpg
264.0,Coloured_Canyon,What created the colors?,Mineral oxidation,,/downloaded_images/img_3673.jpg
264.0,Coloured_Canyon,How high are the walls?,30-40 meters,,/downloaded_images/img_3674.jpg
264.0,Coloured_Canyon,What is essential to bring?,"Water, footwear",,/downloaded_images/img_3675.jpg
264.0,Coloured_Canyon,What type of tour is needed?,Guided tour.,,/downloaded_images/img_3676.jpg
264.0,Coloured_Canyon,Is this a desert?,"Yes, desert.",,/downloaded_images/img_3671.png
264.0,Coloured_Canyon,What is the region?,Sinai Peninsula,,/downloaded_images/img_3672.jpg
264.0,Coloured_Canyon,What is eroding the rock?,Wind and water,,/downloaded_images/img_3673.jpg
265.0,Borg_El_Arab_Stadium,What is the stadium's location?,"Alexandria, Egypt",,/downloaded_images/img_3677.jpg
265.0,Borg_El_Arab_Stadium,What sport is mainly played?,Football (soccer),,/downloaded_images/img_3678.JPG
265.0,Borg_El_Arab_Stadium,How many seats roughly?,"86,000 seats",,/downloaded_images/img_3679.jpg
265.0,Borg_El_Arab_Stadium,Who owns the stadium?,Egyptian Armed Forces,,/downloaded_images/img_3680.jpg
265.0,Borg_El_Arab_Stadium,When was it built?,2006,,/downloaded_images/img_3681.jpg
265.0,Borg_El_Arab_Stadium,Is it small or large?,Large stadium.,,/downloaded_images/img_3682.jpg
265.0,Borg_El_Arab_Stadium,What continent is it in?,Africa.,,/downloaded_images/img_3683.JPG
265.0,Borg_El_Arab_Stadium,Which country is it in?,Egypt.,,/downloaded_images/img_3684.jpg
265.0,Borg_El_Arab_Stadium,What is around the field?,Running track.,,/downloaded_images/img_3685.JPG
265.0,Borg_El_Arab_Stadium,Does it have lights?,"Yes, floodlights.",,/downloaded_images/img_3686.jpg
265.0,Borg_El_Arab_Stadium,Who plays matches here?,Football teams,,/downloaded_images/img_3687.jpg
265.0,Borg_El_Arab_Stadium,Is it a minor venue?,"No, Major.",,/downloaded_images/img_3688.jpg
265.0,Borg_El_Arab_Stadium,What kind of track is there?,Running track,,/downloaded_images/img_3689.JPG
265.0,Borg_El_Arab_Stadium,Is there parking available?,Ample parking.,,/downloaded_images/img_3690.JPG
265.0,Borg_El_Arab_Stadium,Is it a modern stadium?,"Yes, built 2006.",,/downloaded_images/img_3677.jpg
266.0,Egyptian_Geological_Museum,What city is it in?,"Cairo, Egypt",,/downloaded_images/img_3691.JPG
266.0,Egyptian_Geological_Museum,Is it in Africa?,"Yes, Africa",,/downloaded_images/img_3692.JPG
266.0,Egyptian_Geological_Museum,What does it display?,"Rocks, minerals, fossils",,/downloaded_images/img_3693.jpg
266.0,Egyptian_Geological_Museum,What kind of history?,Geological history,,/downloaded_images/img_3694.JPG
266.0,Egyptian_Geological_Museum,Is it for public education?,"Yes, it is.",,/downloaded_images/img_3695.jpg
266.0,Egyptian_Geological_Museum,Are there fossils?,"Yes, fossils.",,/downloaded_images/img_3691.JPG
266.0,Egyptian_Geological_Museum,Where were dinosaurs found?,Western Desert,,/downloaded_images/img_3692.JPG
266.0,Egyptian_Geological_Museum,Are there meteorites?,"Yes, meteorites.",,/downloaded_images/img_3693.jpg
266.0,Egyptian_Geological_Museum,What is a key exhibit?,Dinosaur fossils,,/downloaded_images/img_3694.JPG
266.0,Egyptian_Geological_Museum,Does it train geologists?,"Yes, trains.",,/downloaded_images/img_3695.jpg
266.0,Egyptian_Geological_Museum,What does it preserve?,Geological specimens,,/downloaded_images/img_3691.JPG
266.0,Egyptian_Geological_Museum,What kind of techniques?,Mining & Quarrying,,/downloaded_images/img_3692.JPG
266.0,Egyptian_Geological_Museum,What is promoted?,Natural history.,,/downloaded_images/img_3693.jpg
266.0,Egyptian_Geological_Museum,Is it a research center?,"Yes, research.",,/downloaded_images/img_3694.JPG
266.0,Egyptian_Geological_Museum,Is it very old?,"Yes, old.",,/downloaded_images/img_3695.jpg
267.0,"El-Ma'eini_mosque,_Dumyat",What city is this mosque in?,Dumyat (Damietta),,/downloaded_images/img_3696.jpg
267.0,"El-Ma'eini_mosque,_Dumyat",Is this mosque important?,"Yes, very.",,/downloaded_images/img_3697.jpg
267.0,"El-Ma'eini_mosque,_Dumyat",What country is this in?,Egypt,,/downloaded_images/img_3698.jpg
267.0,"El-Ma'eini_mosque,_Dumyat",Does this have cultural heritage?,"Yes, distinct style.",,/downloaded_images/img_3699.JPG
267.0,"El-Ma'eini_mosque,_Dumyat",What kind of structure is this?,Mosque in Egypt.,,/downloaded_images/img_3700.JPG
267.0,"El-Ma'eini_mosque,_Dumyat",Is this a widely documented mosque?,Not widely documented.,,/downloaded_images/img_3701.jpg
267.0,"El-Ma'eini_mosque,_Dumyat",What language should I search in?,Arabic.,,/downloaded_images/img_3702.jpg
267.0,"El-Ma'eini_mosque,_Dumyat",Is it hard to find details?,"Yes, challenging.",,/downloaded_images/img_3703.jpg
267.0,"El-Ma'eini_mosque,_Dumyat",Are travel blogs helpful?,Potentially helpful,,/downloaded_images/img_3704.jpg
267.0,"El-Ma'eini_mosque,_Dumyat",Should I consult historians?,"Yes, consult.",,/downloaded_images/img_3705.JPG
267.0,"El-Ma'eini_mosque,_Dumyat",What kind of experts can help?,"Historians, Local experts.",,/downloaded_images/img_3706.JPG
267.0,"El-Ma'eini_mosque,_Dumyat",What architectural style is it?,Distinct architectural,,/downloaded_images/img_3707.jpg
267.0,"El-Ma'eini_mosque,_Dumyat",Is this mosque in Egypt?,"Yes, Egypt.",,/downloaded_images/img_3708.JPG
267.0,"El-Ma'eini_mosque,_Dumyat",Is Arabic a useful language?,"Yes, very.",,/downloaded_images/img_3709.jpg
267.0,"El-Ma'eini_mosque,_Dumyat",What is the mosque's name?,El-Ma'eini Mosque,,/downloaded_images/img_3710.jpg
268.0,Pyramid_of_Khentkaus_II,What dynasty is this pyramid from?,Fifth Dynasty,,/downloaded_images/img_3715.jpg
268.0,Pyramid_of_Khentkaus_II,Who does this pyramid belong to?,Khentkaus II.,,/downloaded_images/img_3716.jpg
268.0,Pyramid_of_Khentkaus_II,Where is this pyramid located?,"Abusir, Egypt",,/downloaded_images/img_3717.jpg
268.0,Pyramid_of_Khentkaus_II,Is this site well preserved?,Substantially ruined.,,/downloaded_images/img_3718.jpg
268.0,Pyramid_of_Khentkaus_II,What material was used?,Limestone.,,/downloaded_images/img_3719.JPG
268.0,Pyramid_of_Khentkaus_II,What temple is connected?,Valley temple.,,/downloaded_images/img_3720.jpg
268.0,Pyramid_of_Khentkaus_II,Who excavated this site?,Czech Egyptologists,,/downloaded_images/img_3715.jpg
268.0,Pyramid_of_Khentkaus_II,Are inscriptions present?,"Yes, inscriptions.",,/downloaded_images/img_3716.jpg
268.0,Pyramid_of_Khentkaus_II,Is a sarcophagus present?,"Yes, fragments found.",,/downloaded_images/img_3717.jpg
268.0,Pyramid_of_Khentkaus_II,What is the overall condition?,Substantially ruined.,,/downloaded_images/img_3718.jpg
268.0,Pyramid_of_Khentkaus_II,Is there a valley temple?,"Yes, valley temple.",,/downloaded_images/img_3719.JPG
268.0,Pyramid_of_Khentkaus_II,Is there a causeway?,"Yes, a causeway.",,/downloaded_images/img_3720.jpg
268.0,Pyramid_of_Khentkaus_II,Is there a mortuary temple?,"Yes, adjacent.",,/downloaded_images/img_3715.jpg
268.0,Pyramid_of_Khentkaus_II,Is it a finished pyramid?,Likely unfinished.,,/downloaded_images/img_3716.jpg
268.0,Pyramid_of_Khentkaus_II,Does it have cult chapels?,Possible cult chapels,,/downloaded_images/img_3717.jpg
268.0,Pyramid_of_Khentkaus_II,What is found within?,Sarcophagus fragments.,,/downloaded_images/img_3718.jpg
268.0,Pyramid_of_Khentkaus_II,Is it near other pyramids?,"Yes, near.",,/downloaded_images/img_3719.JPG
268.0,Pyramid_of_Khentkaus_II,Does it show building phases?,"Yes, evidence shows.",,/downloaded_images/img_3720.jpg
268.0,Pyramid_of_Khentkaus_II,Does it help us understand royal women?,"Yes, important.",,/downloaded_images/img_3715.jpg
268.0,Pyramid_of_Khentkaus_II,What is its significance?,Role of women.,,/downloaded_images/img_3716.jpg
269.0,Saint_Mark_Coptic_Orthodox_Church_(Heliopolis),Is this a church?,"Yes, Coptic.",,/downloaded_images/img_3721.jpg
269.0,Saint_Mark_Coptic_Orthodox_Church_(Heliopolis),Denomination?,Coptic Orthodox,,/downloaded_images/img_3722.jpg
269.0,Saint_Mark_Coptic_Orthodox_Church_(Heliopolis),City location?,"Heliopolis, Cairo",,/downloaded_images/img_3723.jpg
269.0,Saint_Mark_Coptic_Orthodox_Church_(Heliopolis),Country?,Egypt,,/downloaded_images/img_3724.jpg
269.0,Saint_Mark_Coptic_Orthodox_Church_(Heliopolis),Does it serve a large congregation?,"Yes, large.",,/downloaded_images/img_3725.jpg
269.0,Saint_Mark_Coptic_Orthodox_Church_(Heliopolis),Does it offer liturgies?,"Yes, it does.",,/downloaded_images/img_3726.jpg
269.0,Saint_Mark_Coptic_Orthodox_Church_(Heliopolis),Are youth programs offered?,"Yes, youth programs.",,/downloaded_images/img_3727.jpg
269.0,Saint_Mark_Coptic_Orthodox_Church_(Heliopolis),Are bible studies offered?,"Yes, bible studies.",,/downloaded_images/img_3728.jpg
269.0,Saint_Mark_Coptic_Orthodox_Church_(Heliopolis),What kind of outreach?,Community outreach.,,/downloaded_images/img_3729.JPG
269.0,Saint_Mark_Coptic_Orthodox_Church_(Heliopolis),Does it have domes?,Likely yes.,,/downloaded_images/img_3730.JPG
269.0,Saint_Mark_Coptic_Orthodox_Church_(Heliopolis),Church style?,Coptic Architecture,,/downloaded_images/img_3731.JPG
269.0,Saint_Mark_Coptic_Orthodox_Church_(Heliopolis),Is it in a suburb?,"Yes, Heliopolis.",,/downloaded_images/img_3732.jpg
269.0,Saint_Mark_Coptic_Orthodox_Church_(Heliopolis),Part of which Church?,Coptic Orthodox,,/downloaded_images/img_3733.jpg
269.0,Saint_Mark_Coptic_Orthodox_Church_(Heliopolis),Is it prominent?,"Yes, prominent.",,/downloaded_images/img_3734.jpg
269.0,Saint_Mark_Coptic_Orthodox_Church_(Heliopolis),Religious affiliation?,Coptic Orthodox,,/downloaded_images/img_3735.jpg
269.0,Saint_Mark_Coptic_Orthodox_Church_(Heliopolis),What is its purpose?,Religious services.,,/downloaded_images/img_3736.jpg
270.0,Cairo_Opera_House,Where is this opera house located?,Gezira Island,,/downloaded_images/img_3747.jpg
270.0,Cairo_Opera_House,What country is this in?,Egypt.,,/downloaded_images/img_3748.jpg
270.0,Cairo_Opera_House,What type of building is this?,Opera house.,,/downloaded_images/img_3749.jpg
270.0,Cairo_Opera_House,Who manages the opera house?,Egyptian Ministry,,/downloaded_images/img_3750.jpg
270.0,Cairo_Opera_House,When was the new one gifted?,1988,,/downloaded_images/img_3751.jpg
270.0,Cairo_Opera_House,What district is it in?,Zamalek district,,/downloaded_images/img_3752.jpg
270.0,Cairo_Opera_House,What was the old opera house called?,Royal Opera House,,/downloaded_images/img_3753.jpg
270.0,Cairo_Opera_House,Who commissioned the original?,Khedive Ismail,,/downloaded_images/img_3754.jpg
270.0,Cairo_Opera_House,What square housed the original?,Ataba Square.,,/downloaded_images/img_3755.JPG
270.0,Cairo_Opera_House,What burned down in 1971?,Royal Opera House,,/downloaded_images/img_3756.JPG
270.0,Cairo_Opera_House,From whom was the new one a gift?,From Japan.,,/downloaded_images/img_3757.jpg
270.0,Cairo_Opera_House,What canal opening was the original for?,Suez Canal,,/downloaded_images/img_3758.jpg
270.0,Cairo_Opera_House,What kind of design is it?,Modern Japanese.,,/downloaded_images/img_3759.JPG
270.0,Cairo_Opera_House,What is the cultural center called?,National Cultural Centre,,/downloaded_images/img_3760.jpg
270.0,Cairo_Opera_House,What events are performed here?,"Opera, ballet",,/downloaded_images/img_3761.JPG
270.0,Cairo_Opera_House,What island is it on?,Gezira Island,,/downloaded_images/img_3762.jpg
270.0,Cairo_Opera_House,Does the original still exist?,No longer.,,/downloaded_images/img_3763.jpg
270.0,Cairo_Opera_House,What ministry manages it?,Culture Ministry,,/downloaded_images/img_3764.jpg
