Index,Concept,Question,Answer,Photo,photo_path
198.0,Amr_Ibn_al-Aas_Mosque_(Damietta),Does it represent Islam?,"Yes, Islam",,/downloaded_images/img_2478.jpg
198.0,Amr_Ibn_al-Aas_Mosque_(Damietta),Is it a cultural heritage?,"Yes, cultural heritage.",,/downloaded_images/img_2479.jpg
198.0,Amr_Ibn_al-Aas_Mosque_(Damietta),Is it very old?,"Yes, rebuilt.",,/downloaded_images/img_2480.JPG
,Amr_Ibn_al-Aas_Mosque_(Damietta),Is it ornate?,Relatively simple.,,
198.0,Amr_Ibn_al-Aas_Mosque_(Damietta),Is it still used?,Implied yes.,,/downloaded_images/img_2481.JPG
198.0,Amr_Ibn_al-Aas_Mosque_(Damietta),Is it stone-built?,"Likely, yes.",,/downloaded_images/img_2482.JPG
199.0,Montaza_Palace,What city is this in?,"Alexandria, Egypt",,/downloaded_images/img_2483.jpg
199.0,Montaza_Palace,What sea is nearby?,Mediterranean Sea,,/downloaded_images/img_2484.jpg
199.0,Montaza_Palace,Royal family used this as what?,Summer residence.,,/downloaded_images/img_2485.jpg
199.0,Montaza_Palace,What kind of gardens surround it?,"Lush, extensive gardens.",,/downloaded_images/img_2486.jpg
199.0,Montaza_Palace,What is Al-Salamlek now?,Luxury hotel.,,/downloaded_images/img_2487.jpg
199.0,Montaza_Palace,Who built the palace originally?,Khedive Abbas II,,/downloaded_images/img_2488.jpg
199.0,Montaza_Palace,What is the other palace's name?,Al-Salamlek Palace,,/downloaded_images/img_2483.jpg
199.0,Montaza_Palace,What is a major attraction here?,Montaza Gardens,,/downloaded_images/img_2484.jpg
199.0,Montaza_Palace,What architectural styles are present?,"Florentine, Ottoman.",,/downloaded_images/img_2485.jpg
199.0,Montaza_Palace,What is a key feature of the grounds?,Walking paths,,/downloaded_images/img_2486.jpg
199.0,Montaza_Palace,What can you do in the gardens?,Walk and relax,,/downloaded_images/img_2487.jpg
199.0,Montaza_Palace,What is this location's purpose?,Historical complex,,/downloaded_images/img_2488.jpg
199.0,Montaza_Palace,Which palace is bigger?,Al-Haramlik Palace,,/downloaded_images/img_2483.jpg
199.0,Montaza_Palace,Is Al-Haramlik open?,Not always.,,/downloaded_images/img_2484.jpg
199.0,Montaza_Palace,What is found on the eastern edge?,"Alexandria, Egypt",,/downloaded_images/img_2485.jpg
200.0,6_October_Bridge,What city is this in?,"Cairo, Egypt",,/downloaded_images/img_2489.JPG
200.0,6_October_Bridge,What is this structure?,Road bridge.,,/downloaded_images/img_2490.JPG
200.0,6_October_Bridge,What river does it cross?,Nile River,,/downloaded_images/img_2491.JPG
200.0,6_October_Bridge,What is its purpose?,Transportation route.,,/downloaded_images/img_2492.jpg
200.0,6_October_Bridge,When did construction end?,1996,,/downloaded_images/img_2493.jpg
200.0,6_October_Bridge,What is it made of?,Concrete pillars,,/downloaded_images/img_2494.jpg
200.0,6_October_Bridge,Is it often busy?,Heavily congested.,,/downloaded_images/img_2495.jpg
200.0,6_October_Bridge,What is its nickname origin?,October 6th War,,/downloaded_images/img_2496.jpg
200.0,6_October_Bridge,What kind of road is it?,Elevated road,,/downloaded_images/img_2497.jpg
200.0,6_October_Bridge,Is it an African landmark?,"Yes, landmark.",,/downloaded_images/img_2498.jpg
201.0,Ben_Ezra_Synagogue,What country is this in?,Egypt.,,/downloaded_images/img_2507.JPG
201.0,Ben_Ezra_Synagogue,What was found here?,Cairo Genizah,,/downloaded_images/img_2508.jpg
201.0,Ben_Ezra_Synagogue,Who found the documents?,Solomon Schechter,,/downloaded_images/img_2509.jpg
201.0,Ben_Ezra_Synagogue,What century did it exist by?,9th century,,/downloaded_images/img_2510.JPG
201.0,Ben_Ezra_Synagogue,What is it a landmark of?,Rich history.,,/downloaded_images/img_2511.jpg
201.0,Ben_Ezra_Synagogue,What city is this in?,"Cairo, Egypt",,/downloaded_images/img_2512.jpg
201.0,Ben_Ezra_Synagogue,Was it ever renovated?,"Yes, several times.",,/downloaded_images/img_2513.jpg
201.0,Ben_Ezra_Synagogue,What is it named after?,Ezra the Scribe,,/downloaded_images/img_2514.jpg
201.0,Ben_Ezra_Synagogue,Was Moses found here?,Tradition says.,,/downloaded_images/img_2515.jpg
201.0,Ben_Ezra_Synagogue,Is it a tourist spot?,"Yes, tourist attraction.",,/downloaded_images/img_2516.jpg
201.0,Ben_Ezra_Synagogue,Is the community large?,Significantly smaller.,,/downloaded_images/img_2517.jpg
201.0,Ben_Ezra_Synagogue,What kind of documents were found?,Jewish texts,,/downloaded_images/img_2518.jpg
201.0,Ben_Ezra_Synagogue,What is its other name?,Al-Shamiyyin Synagogue,,/downloaded_images/img_2519.jpg
201.0,Ben_Ezra_Synagogue,What is kept here?,Genizah documents,,/downloaded_images/img_2520.jpg
201.0,Ben_Ezra_Synagogue,Where was the genizah taken?,Cambridge University,,/downloaded_images/img_2521.jpg
202.0,Bent_Pyramid,What is this structure's shape?,Bent/Two-angled,,/downloaded_images/img_2561.jpg
202.0,Bent_Pyramid,Where is this pyramid located?,"Dahshur, Egypt",,/downloaded_images/img_2562.jpg
202.0,Bent_Pyramid,Who built this pyramid?,Sneferu.,,/downloaded_images/img_2563.jpg
202.0,Bent_Pyramid,What pharaoh ruled?,Sneferu,,/downloaded_images/img_2564.jpg
202.0,Bent_Pyramid,Which kingdom is it from?,Old Kingdom,,/downloaded_images/img_2565.jpg
202.0,Bent_Pyramid,What is its main feature?,Bent Appearance,,/downloaded_images/img_2561.jpg
202.0,Bent_Pyramid,What are the angles?,54 and 43,,/downloaded_images/img_2562.jpg
202.0,Bent_Pyramid,Is it a step pyramid?,No. Transitional pyramid.,,/downloaded_images/img_2563.jpg
202.0,Bent_Pyramid,Is it a true pyramid?,Transitional pyramid.,,/downloaded_images/img_2564.jpg
202.0,Bent_Pyramid,What is its period?,Old Kingdom,,/downloaded_images/img_2565.jpg
202.0,Bent_Pyramid,Does it have two entrances?,"Yes, it does.",,/downloaded_images/img_2561.jpg
202.0,Bent_Pyramid,What is the original finish?,Polished limestone,,/downloaded_images/img_2562.jpg
202.0,Bent_Pyramid,What caused the bend?,Structural Instability,,/downloaded_images/img_2563.jpg
202.0,Bent_Pyramid,Is there limestone casing?,"Yes, remaining.",,/downloaded_images/img_2564.jpg
202.0,Bent_Pyramid,What is its significance?,Transitional pyramid.,,/downloaded_images/img_2565.jpg
203.0,"Crystal_Mountain,_White_Desert",What desert is shown?,Western Desert,,/downloaded_images/img_2566.jpg
203.0,"Crystal_Mountain,_White_Desert",What color is the desert?,White and Crystalline,,/downloaded_images/img_2566.jpg
203.0,"Crystal_Mountain,_White_Desert",What is Crystal Mountain made of?,Quartz crystals,,/downloaded_images/img_2566.jpg
203.0,"Crystal_Mountain,_White_Desert",What activity is common?,Desert Tours,,/downloaded_images/img_2566.jpg
203.0,"Crystal_Mountain,_White_Desert",Where is the Crystal Mountain?,Egypt's Western Desert,,/downloaded_images/img_2566.jpg
203.0,"Crystal_Mountain,_White_Desert",What shapes the landscape?,Wind and erosion,,/downloaded_images/img_2566.jpg
203.0,"Crystal_Mountain,_White_Desert",What is near Farafra?,White Desert,,/downloaded_images/img_2566.jpg
203.0,"Crystal_Mountain,_White_Desert",What park protects this?,White Desert,,/downloaded_images/img_2566.jpg
203.0,"Crystal_Mountain,_White_Desert",What sparkles in the sun?,Quartz crystals,,/downloaded_images/img_2566.jpg
203.0,"Crystal_Mountain,_White_Desert",What causes concern?,Tourist damage.,,/downloaded_images/img_2566.jpg
203.0,"Crystal_Mountain,_White_Desert",What is required for travel?,Tour operators.,,/downloaded_images/img_2566.jpg
203.0,"Crystal_Mountain,_White_Desert",What should visitors respect?,Natural environment.,,/downloaded_images/img_2566.jpg
203.0,"Crystal_Mountain,_White_Desert",What is Sahara el Beyda?,White Desert,,/downloaded_images/img_2566.jpg
203.0,"Crystal_Mountain,_White_Desert",What activity is popular at night?,"Stargazing, camping",,/downloaded_images/img_2566.jpg
203.0,"Crystal_Mountain,_White_Desert",What oasis is nearby?,Farafra Oasis,,/downloaded_images/img_2566.jpg
204.0,Pyramid_of_Djedkare_Isesi,What is the pyramid's location?,South Saqqara,,/downloaded_images/img_2567.jpg
204.0,Pyramid_of_Djedkare_Isesi,Which dynasty is it from?,Fifth Dynasty,,/downloaded_images/img_2568.JPG
204.0,Pyramid_of_Djedkare_Isesi,Who was the pharaoh?,Djedkare Isesi,,/downloaded_images/img_2569.jpg
204.0,Pyramid_of_Djedkare_Isesi,What was its ancient name?,Nefer Djedkare,,/downloaded_images/img_2570.jpg
204.0,Pyramid_of_Djedkare_Isesi,Is it well-preserved?,Heavily Ruined.,,/downloaded_images/img_2571.jpg
204.0,Pyramid_of_Djedkare_Isesi,What covers the core?,Tura limestone,,/downloaded_images/img_2572.jpg
204.0,Pyramid_of_Djedkare_Isesi,What is at the edge?,Cultivation edge.,,/downloaded_images/img_2573.JPG
204.0,Pyramid_of_Djedkare_Isesi,What leads to the temple?,Covered walkway.,,/downloaded_images/img_2574.jpg
204.0,Pyramid_of_Djedkare_Isesi,Where is the temple located?,East side,,/downloaded_images/img_2575.jpg
204.0,Pyramid_of_Djedkare_Isesi,Where is the cult pyramid?,Southeast corner.,,/downloaded_images/img_2576.jpg
204.0,Pyramid_of_Djedkare_Isesi,Where is the entrance?,North side.,,/downloaded_images/img_2577.jpg
204.0,Pyramid_of_Djedkare_Isesi,What once held the sarcophagus?,Burial chamber.,,/downloaded_images/img_2578.jpg
204.0,Pyramid_of_Djedkare_Isesi,Is it north or south?,South Saqqara,,/downloaded_images/img_2579.jpg
204.0,Pyramid_of_Djedkare_Isesi,Does it have reliefs?,"Yes, Mortuary Temple",,/downloaded_images/img_2580.jpg
204.0,Pyramid_of_Djedkare_Isesi,What is the ruin's style?,"Stepped, Tura limestone",,/downloaded_images/img_2581.jpg
204.0,Pyramid_of_Djedkare_Isesi,Was he the 8th ruler?,Possibly ninth.,,/downloaded_images/img_2582.JPG
204.0,Pyramid_of_Djedkare_Isesi,Is it located in Abusir?,"No, South Saqqara.",,/downloaded_images/img_2583.jpg
204.0,Pyramid_of_Djedkare_Isesi,What is the core made of?,Limestone blocks.,,/downloaded_images/img_2584.jpg
204.0,Pyramid_of_Djedkare_Isesi,Was it finely decorated?,Mortuary temple.,,/downloaded_images/img_2585.jpg
204.0,Pyramid_of_Djedkare_Isesi,Is it a valuable source?,"Yes, valuable source.",,/downloaded_images/img_2586.jpg
205.0,Alexandria_Zoo,What city is this zoo in?,"Alexandria, Egypt",,/downloaded_images/img_2596.jpg
205.0,Alexandria_Zoo,When was it established?,1937,,/downloaded_images/img_2597.JPG
205.0,Alexandria_Zoo,What animals might live here?,"Lions, Monkeys",,/downloaded_images/img_2598.JPG
205.0,Alexandria_Zoo,Is animal welfare a concern?,"Yes, significant concerns.",,/downloaded_images/img_2599.JPG
205.0,Alexandria_Zoo,What kind of attraction is this?,Zoological garden,,/downloaded_images/img_2600.jpg
205.0,Alexandria_Zoo,Is this a popular place?,"Yes, popular.",,/downloaded_images/img_2601.jpg
205.0,Alexandria_Zoo,What is the zoo's purpose?,Zoological garden.,,/downloaded_images/img_2602.jpg
205.0,Alexandria_Zoo,Is hygiene likely good?,Likely poor.,,/downloaded_images/img_2603.jpg
205.0,Alexandria_Zoo,Are renovations happening now?,Progress remains a challenge.,,/downloaded_images/img_2604.jpg
205.0,Alexandria_Zoo,What is the zoo's location?,"Alexandria, Egypt",,/downloaded_images/img_2605.JPG
205.0,Alexandria_Zoo,Are enclosures generally adequate?,Generally inadequate,,/downloaded_images/img_2606.jpg
205.0,Alexandria_Zoo,Is the zoo uncontroversial?,Highly Controversial,,/downloaded_images/img_2607.jpg
205.0,Alexandria_Zoo,Is it one of Egypt's oldest?,Established 1937,,/downloaded_images/img_2608.jpg
205.0,Alexandria_Zoo,Are the animals well-cared for?,"Generally, no.",,/downloaded_images/img_2609.jpg
205.0,Alexandria_Zoo,Is it only for conservation?,"No, displaying animals.",,/downloaded_images/img_2610.jpg
205.0,Alexandria_Zoo,Is it well-maintained?,Poorly maintained.,,/downloaded_images/img_2611.jpg
205.0,Alexandria_Zoo,Are there many tigers?,Reports often mention.,,/downloaded_images/img_2612.jpg
205.0,Alexandria_Zoo,Does it get many visitors?,"Yes, many.",,/downloaded_images/img_2613.jpg
205.0,Alexandria_Zoo,What's the condition of the zoo?,"Poor, controversial conditions.",,/downloaded_images/img_2614.jpg
205.0,Alexandria_Zoo,Are conditions improving quickly?,Progress remains challenging.,,/downloaded_images/img_2596.jpg
205.0,Alexandria_Zoo,Is it only for tourists?,"No, locals.",,/downloaded_images/img_2597.JPG
205.0,Alexandria_Zoo,What is the general state?,Poor animal welfare.,,/downloaded_images/img_2598.JPG
205.0,Alexandria_Zoo,Is veterinary care sufficient?,Insufficient veterinary care,,/downloaded_images/img_2599.JPG
205.0,Alexandria_Zoo,Is it considered a cultural site?,Point of debate,,/downloaded_images/img_2600.jpg
205.0,Alexandria_Zoo,Are renovations sustained?,A challenge.,,/downloaded_images/img_2601.jpg
205.0,Alexandria_Zoo,Are animals' housings adequate?,"Generally, no.",,/downloaded_images/img_2602.jpg
205.0,Alexandria_Zoo,Is it a good zoo?,Probably not.,,/downloaded_images/img_2603.jpg
205.0,Alexandria_Zoo,What is frequently highlighted?,Inadequate housing.,,/downloaded_images/img_2604.jpg
205.0,Alexandria_Zoo,Do animals get mistreated?,"Potentially, Yes",,/downloaded_images/img_2605.JPG
206.0,Monastery_of_Saint_Macarius_the_Great,What religion is practiced there?,Coptic Orthodox,,/downloaded_images/img_2615.png
206.0,Monastery_of_Saint_Macarius_the_Great,Who founded the monastery?,Saint Macarius,,/downloaded_images/img_2616.png
206.0,Monastery_of_Saint_Macarius_the_Great,Where is this monastery located?,Wadi El Natrun,,/downloaded_images/img_2617.png
206.0,Monastery_of_Saint_Macarius_the_Great,What century was it founded?,4th century,,/downloaded_images/img_2618.png
206.0,Monastery_of_Saint_Macarius_the_Great,What is Deir Abu Maqar also known as?,Saint Macarius.,,/downloaded_images/img_2619.png
206.0,Monastery_of_Saint_Macarius_the_Great,What is a key defensive feature?,Qasr (Fortified Tower),,/downloaded_images/img_2620.png
206.0,Monastery_of_Saint_Macarius_the_Great,What kind of books are in the library?,Coptic manuscripts.,,/downloaded_images/img_2621.png
206.0,Monastery_of_Saint_Macarius_the_Great,Is it still an active monastery?,"Yes, active.",,/downloaded_images/img_2622.png
206.0,Monastery_of_Saint_Macarius_the_Great,What is the wider region known for?,Soda lakes.,,/downloaded_images/img_2623.png
206.0,Monastery_of_Saint_Macarius_the_Great,What is found in the tombs?,Patriarchs burial places,,/downloaded_images/img_2615.png
206.0,Monastery_of_Saint_Macarius_the_Great,What type of church is it?,Coptic Orthodox,,/downloaded_images/img_2616.png
206.0,Monastery_of_Saint_Macarius_the_Great,What is its historical significance?,Coptic Monasticism Center,,/downloaded_images/img_2617.png
206.0,Monastery_of_Saint_Macarius_the_Great,What is a notable building material?,Not specified.,,/downloaded_images/img_2618.png
206.0,Monastery_of_Saint_Macarius_the_Great,What is found inside the ancient church?,Religious art,,/downloaded_images/img_2619.png
206.0,Monastery_of_Saint_Macarius_the_Great,Does it welcome visitors?,"Yes, it does.",,/downloaded_images/img_2620.png
206.0,Monastery_of_Saint_Macarius_the_Great,What surrounds the monastery?,Desert region,,/downloaded_images/img_2621.png
206.0,Monastery_of_Saint_Macarius_the_Great,What is being preserved?,Coptic traditions.,,/downloaded_images/img_2622.png
206.0,Monastery_of_Saint_Macarius_the_Great,What is the general architectural style?,Fortified/Ancient architecture.,,/downloaded_images/img_2623.png
206.0,Monastery_of_Saint_Macarius_the_Great,What happened often in the past?,Bedouin Raids,,/downloaded_images/img_2615.png
206.0,Monastery_of_Saint_Macarius_the_Great,What is it a center of?,Monasticism,,/downloaded_images/img_2616.png
207.0,Pyramid_of_Userkaf,What pharaoh built this?,Userkaf,,/downloaded_images/img_2624.jpg
207.0,Pyramid_of_Userkaf,Where is this pyramid located?,Saqqara necropolis,,/downloaded_images/img_2624.jpg
207.0,Pyramid_of_Userkaf,What dynasty built this?,Fifth Dynasty,,/downloaded_images/img_2624.jpg
207.0,Pyramid_of_Userkaf,Is it well preserved?,Heavily ruined.,,/downloaded_images/img_2624.jpg
207.0,Pyramid_of_Userkaf,What is this called?,Pyramid_of_Userkaf,,/downloaded_images/img_2624.jpg
207.0,Pyramid_of_Userkaf,Is it a mortuary complex?,"Yes, Userkaf's.",,/downloaded_images/img_2624.jpg
207.0,Pyramid_of_Userkaf,What color was it cased in?,White limestone.,,/downloaded_images/img_2624.jpg
207.0,Pyramid_of_Userkaf,Is it large or small?,"Small, ruined.",,/downloaded_images/img_2624.jpg
207.0,Pyramid_of_Userkaf,What is its current state?,Heavily ruined.,,/downloaded_images/img_2624.jpg
207.0,Pyramid_of_Userkaf,Does it have a cult pyramid?,"Yes, separate.",,/downloaded_images/img_2624.jpg
207.0,Pyramid_of_Userkaf,Where's the mortuary temple?,South side.,,/downloaded_images/img_2624.jpg
207.0,Pyramid_of_Userkaf,Is it near Djoser's pyramid?,"Yes, near.",,/downloaded_images/img_2624.jpg
207.0,Pyramid_of_Userkaf,What was it intended for?,Afterlife journey.,,/downloaded_images/img_2624.jpg
207.0,Pyramid_of_Userkaf,Is it in the Saqqara necropolis?,"Yes, Saqqara",,/downloaded_images/img_2624.jpg
207.0,Pyramid_of_Userkaf,Is it heavily ruined?,"Yes, heavily.",,/downloaded_images/img_2624.jpg
207.0,Pyramid_of_Userkaf,Is the solar cult reflected?,"Yes, reflected.",,/downloaded_images/img_2624.jpg
207.0,Pyramid_of_Userkaf,What's on the south side?,Mortuary temple.,,/downloaded_images/img_2624.jpg
207.0,Pyramid_of_Userkaf,Is it from the Fourth Dynasty?,"No, Fifth.",,/downloaded_images/img_2624.jpg
207.0,Pyramid_of_Userkaf,Was limestone removed?,"Yes, removed.",,/downloaded_images/img_2624.jpg
207.0,Pyramid_of_Userkaf,Was it elaborately decorated?,Mortuary Temple was.,,/downloaded_images/img_2624.jpg
208.0,Valley_of_the_Queens,Where is this valley located?,Thebes (modern Luxor),,/downloaded_images/img_2625.JPG
208.0,Valley_of_the_Queens,Which river is nearby?,Nile River,,/downloaded_images/img_2626.jpg
208.0,Valley_of_the_Queens,Who was buried here?,Royal women/children,,/downloaded_images/img_2627.JPG
208.0,Valley_of_the_Queens,Whose tomb is most famous?,Nefertari's tomb,,/downloaded_images/img_2628.jpg
208.0,Valley_of_the_Queens,Which pharaoh was Nefertari's husband?,Ramesses II.,,/downloaded_images/img_2629.png
208.0,Valley_of_the_Queens,What's in the tombs?,Funerary texts.,,/downloaded_images/img_2630.jpg
208.0,Valley_of_the_Queens,What book is shown?,Funerary texts.,,/downloaded_images/img_2631.JPG
208.0,Valley_of_the_Queens,Are tombs elaborate here?,"Sometimes, richly.",,/downloaded_images/img_2625.JPG
208.0,Valley_of_the_Queens,How many tombs exist?,Around 90.,,/downloaded_images/img_2626.jpg
208.0,Valley_of_the_Queens,What is the purpose?,Burial Site,,/downloaded_images/img_2627.JPG
208.0,Valley_of_the_Queens,What dynasty is it?,New Kingdom,,/downloaded_images/img_2628.jpg
208.0,Valley_of_the_Queens,Is research ongoing?,"Yes, ongoing.",,/downloaded_images/img_2629.png
208.0,Valley_of_the_Queens,Is it a cemetery?,"Yes, necropolis.",,/downloaded_images/img_2630.jpg
208.0,Valley_of_the_Queens,Who was Ahmose's father?,Seqenenre Tao II,,/downloaded_images/img_2631.JPG
208.0,Valley_of_the_Queens,What is its significance?,Royal Burial Site,,/downloaded_images/img_2625.JPG
208.0,Valley_of_the_Queens,Is it near Valley Kings?,Geographically near,,/downloaded_images/img_2626.jpg
208.0,Valley_of_the_Queens,Are they well-preserved?,Some are.,,/downloaded_images/img_2627.JPG
208.0,Valley_of_the_Queens,What is its other name?,Wadi Biban el-Harim,,/downloaded_images/img_2628.jpg
208.0,Valley_of_the_Queens,Is this the west bank?,"Yes, west bank.",,/downloaded_images/img_2629.png
208.0,Valley_of_the_Queens,What is modern Luxor?,"Thebes, Egypt.",,/downloaded_images/img_2630.jpg
209.0,Cairo_International_Stadium,What city is this stadium in?,"Cairo, Egypt",,/downloaded_images/img_2632.jpg
209.0,Cairo_International_Stadium,What sport is primarily played here?,Football (Soccer),,/downloaded_images/img_2633.jpg
209.0,Cairo_International_Stadium,Is this a multi-purpose stadium?,"Yes, multi-purpose",,/downloaded_images/img_2634.jpg
209.0,Cairo_International_Stadium,When did this stadium open?,1960,,/downloaded_images/img_2635.jpg
209.0,Cairo_International_Stadium,Who owns this stadium?,Egyptian Government,,/downloaded_images/img_2632.jpg
209.0,Cairo_International_Stadium,What surrounds the football pitch?,Athletics track.,,/downloaded_images/img_2633.jpg
209.0,Cairo_International_Stadium,Was it renovated recently?,"Yes, recently.",,/downloaded_images/img_2634.jpg
209.0,Cairo_International_Stadium,What's its approximate capacity?,"75,000-80,000 seats",,/downloaded_images/img_2635.jpg
209.0,Cairo_International_Stadium,Is it a home stadium for Egypt?,"Yes, it is.",,/downloaded_images/img_2632.jpg
209.0,Cairo_International_Stadium,What is another name for it?,Stad El Qahira,,/downloaded_images/img_2633.jpg
209.0,Cairo_International_Stadium,Is it used for cultural events?,"Yes, cultural events.",,/downloaded_images/img_2634.jpg
209.0,Cairo_International_Stadium,Does it have floodlighting?,"Yes, floodlighting",,/downloaded_images/img_2635.jpg
209.0,Cairo_International_Stadium,Is it government owned?,"Yes, Egyptian.",,/downloaded_images/img_2632.jpg
209.0,Cairo_International_Stadium,Was the stadium updated for the 2019 AFCON?,"Yes, renovated",,/downloaded_images/img_2633.jpg
209.0,Cairo_International_Stadium,Is it of historical importance?,"Yes, significant.",,/downloaded_images/img_2634.jpg
210.0,Sakakini_Palace,What city is this in?,"Cairo, Egypt",,/downloaded_images/img_2636.jpg
210.0,Sakakini_Palace,What type of building is this?,Palace/Museum,,/downloaded_images/img_2637.JPG
210.0,Sakakini_Palace,Who built this palace?,Sakakini Pasha,,/downloaded_images/img_2638.jpg
210.0,Sakakini_Palace,What architectural style is it?,Rococo Revival,,/downloaded_images/img_2639.jpg
210.0,Sakakini_Palace,What year was it built?,1897,,/downloaded_images/img_2640.jpg
210.0,Sakakini_Palace,What is it used for now?,Medical Museum,,/downloaded_images/img_2641.jpg
210.0,Sakakini_Palace,What ministry runs it now?,Health Ministry,,/downloaded_images/img_2642.jpg
210.0,Sakakini_Palace,What nationality was Sakakini?,Lebanese/Egyptian,,/downloaded_images/img_2643.JPG
210.0,Sakakini_Palace,What is displayed inside?,Medical information.,,/downloaded_images/img_2644.jpg
210.0,Sakakini_Palace,Is it a historical landmark?,"Yes, important landmark",,/downloaded_images/img_2645.jpg
210.0,Sakakini_Palace,Is it richly decorated?,"Yes, ornate.",,/downloaded_images/img_2646.jpg
210.0,Sakakini_Palace,Is it an Egyptian museum?,"Yes, Medical.",,/downloaded_images/img_2647.jpg
210.0,Sakakini_Palace,Is it a private residence?,No longer.,,/downloaded_images/img_2648.JPG
210.0,Sakakini_Palace,Is it located in Cairo?,"Yes, Cairo",,/downloaded_images/img_2649.JPG
210.0,Sakakini_Palace,Who owned it originally?,Sakakini Pasha,,/downloaded_images/img_2650.jpg
211.0,Dendera_Temple_complex,What goddess is the main temple dedicated to?,Hathor Goddess,,/downloaded_images/img_2734.JPG
211.0,Dendera_Temple_complex,What is the complex also known as?,"Iunet, Tentyris",,/downloaded_images/img_2735.JPG
211.0,Dendera_Temple_complex,What is on the roof of Hathor Temple?,Zodiac Ceiling,,/downloaded_images/img_2734.JPG
211.0,Dendera_Temple_complex,What period was Hathor Temple built in?,Ptolemaic and Roman,,/downloaded_images/img_2735.JPG
211.0,Dendera_Temple_complex,What is located in the Louvre Museum?,Zodiac ceiling.,,/downloaded_images/img_2734.JPG
211.0,Dendera_Temple_complex,What do the crypts contain?,Religious iconography.,,/downloaded_images/img_2735.JPG
211.0,Dendera_Temple_complex,What is Ihy the son of?,Hathor and Horus,,/downloaded_images/img_2734.JPG
211.0,Dendera_Temple_complex,What type of lake is there?,Sacred lake,,/downloaded_images/img_2735.JPG
211.0,Dendera_Temple_complex,What was the Sanatorium used for?,Healing rituals.,,/downloaded_images/img_2734.JPG
211.0,Dendera_Temple_complex,What river is the complex located on?,Nile River,,/downloaded_images/img_2735.JPG
211.0,Dendera_Temple_complex,Where is Dendera located relative to Luxor?,North of Luxor,,/downloaded_images/img_2734.JPG
211.0,Dendera_Temple_complex,What pillar is depicted in the crypts?,Djed pillar,,/downloaded_images/img_2735.JPG
211.0,Dendera_Temple_complex,What flower is depicted in the crypts?,Lotus flower,,/downloaded_images/img_2734.JPG
211.0,Dendera_Temple_complex,What does the djed pillar represent?,Stability.,,/downloaded_images/img_2735.JPG
211.0,Dendera_Temple_complex,What is the main temple's name?,Temple of Hathor,,/downloaded_images/img_2734.JPG
211.0,Dendera_Temple_complex,What is the zodiac ceiling's location?,Osiris chapel,,/downloaded_images/img_2735.JPG
211.0,Dendera_Temple_complex,What is the smaller temple dedicated to?,Isis.,,/downloaded_images/img_2734.JPG
211.0,Dendera_Temple_complex,What can still be seen on site?,Sacred lake,,/downloaded_images/img_2735.JPG
211.0,Dendera_Temple_complex,What is north of Luxor?,Dendera Temple.,,/downloaded_images/img_2734.JPG
211.0,Dendera_Temple_complex,What is found within Hathor Temple?,Hidden crypts,,/downloaded_images/img_2735.JPG
212.0,Islamic_Cairo,What area does this depict?,Islamic Cairo,,/downloaded_images/img_2736.JPG
212.0,Islamic_Cairo,What century did it develop from?,7th Century,,/downloaded_images/img_2737.JPG
212.0,Islamic_Cairo,What faith influenced this area?,Islamic faith.,,/downloaded_images/img_2738.JPG
212.0,Islamic_Cairo,What architectural styles are present?,"Fatimid, Ayyubid",,/downloaded_images/img_2739.jpg
212.0,Islamic_Cairo,What patterns are used?,"Geometric, Calligraphy",,/downloaded_images/img_2740.jpg
212.0,Islamic_Cairo,Is Al-Azhar a mosque or university?,Both.,,/downloaded_images/img_2741.jpg
212.0,Islamic_Cairo,Who founded the Citadel?,Saladin (or Salah al-Din),,/downloaded_images/img_2742.jpg
212.0,Islamic_Cairo,What is Khan el-Khalili?,Famous bazaar.,,/downloaded_images/img_2743.jpg
212.0,Islamic_Cairo,Is this a living heritage?,"Yes, it is.",,/downloaded_images/img_2744.jpg
212.0,Islamic_Cairo,Since when is it UNESCO listed?,Since 1979.,,/downloaded_images/img_2745.JPG
212.0,Islamic_Cairo,What affects this location?,"Overpopulation, pollution.",,/downloaded_images/img_2746.jpg
